id,title,description,image,tags,detailImages,longDescription
1,"Modular Audio Interface","Hardware-software system for professional audio production with modular connectivity.","https://via.placeholder.com/600x400/2c2c2c/ffffff?text=Modular+Audio+Interface","Hardware,Audio,Interface","https://via.placeholder.com/800x600/2c2c2c/ffffff?text=Interface+Overview,https://via.placeholder.com/800x600/3c3c3c/ffffff?text=Module+System,https://via.placeholder.com/800x600/4c4c4c/ffffff?text=Software+Control","Development of a modular audio interface system that bridges professional studio equipment with modern digital workflows. The project required extensive research into signal processing, electromagnetic compatibility, and user interface design.\n\nTechnical specifications:\n• 24-bit/192kHz conversion\n• Modular I/O expansion\n• Software-controlled routing matrix\n• USB-C and Thunderbolt connectivity\n• Field-replaceable components"
2,"Inventory Management Platform","Digital tool for tracking and optimizing physical product inventory across multiple locations.","https://via.placeholder.com/600x400/f8f9fa/495057?text=Inventory+Platform","Software,Logistics,Analytics","https://via.placeholder.com/800x600/f8f9fa/495057?text=Dashboard+View,https://via.placeholder.com/800x600/e9ecef/495057?text=Analytics+Panel,https://via.placeholder.com/800x600/dee2e6/495057?text=Mobile+Interface","Comprehensive platform for managing physical inventory across distributed locations. System integrates barcode scanning, predictive analytics, and automated reordering to minimize stockouts while optimizing storage costs.\n\nCore functionality:\n• Real-time inventory tracking\n• Predictive demand modeling\n• Automated procurement workflows\n• Multi-location synchronization\n• Integration with existing ERP systems"
3,"Sustainable Lighting System","Environmentally conscious lighting fixtures with intelligent control and minimal material waste.","https://via.placeholder.com/600x400/e8f5e8/2e7d32?text=Lighting+System","Lighting,Sustainability,IoT","https://via.placeholder.com/800x600/e8f5e8/2e7d32?text=Fixture+Design,https://via.placeholder.com/800x600/c8e6c9/2e7d32?text=Control+Interface,https://via.placeholder.com/800x600/a5d6a7/2e7d32?text=Installation","Design and engineering of a modular lighting system prioritizing material efficiency and longevity. Each fixture incorporates recyclable components, field-replaceable LED modules, and intelligent dimming controls.\n\nSustainability features:\n• 95% recyclable materials\n• 50,000+ hour LED lifespan\n• Daylight harvesting sensors\n• Occupancy-based dimming\n• Minimal packaging design\n• Local manufacturing capability"
4,"Workspace Acoustic Panel System","Modular sound absorption system for open office environments.","https://via.placeholder.com/600x400/f3e5f5/7b1fa2?text=Acoustic+Panels","Physical,Acoustics,Modular","https://via.placeholder.com/800x600/f3e5f5/7b1fa2?text=Panel+Configurations,https://via.placeholder.com/800x600/e1bee7/7b1fa2?text=Installation+System,https://via.placeholder.com/800x600/ce93d8/7b1fa2?text=Material+Detail","Acoustic panel system designed to address noise pollution in contemporary workspaces. Panels feature recyclable core materials with fabric coverings available in multiple configurations.\n\nSystem features:\n• NRC rating of 0.85\n• Tool-free installation\n• Multiple mounting options\n• Sustainable material sourcing\n• Custom sizing available\n• Integrated cable management"
5,"Medical Device Interface","Touch interface for diagnostic equipment with emphasis on clarity and precision.","https://via.placeholder.com/600x400/e3f2fd/1565c0?text=Medical+Interface","Medical,Interface,Hardware","https://via.placeholder.com/800x600/e3f2fd/1565c0?text=Interface+Design,https://via.placeholder.com/800x600/bbdefb/1565c0?text=Workflow+Optimization,https://via.placeholder.com/800x600/90caf9/1565c0?text=Clinical+Testing","User interface design for critical medical diagnostic equipment requiring precise data input and clear information display. Project involved extensive user research with medical professionals.\n\nDesign considerations:\n• FDA compliance requirements\n• High contrast display optimization\n• Gesture-based navigation\n• Sterile operation compatibility\n• Emergency procedure protocols\n• Multi-language support"
